[
  {
    "eval_id": "EVAL-DORA-001",
    "user_query": "Calculate our team DORA deployment frequency and lead time for changes over the last 30 days.",
    "domain_category": "multi_agent",
    "expected_domains": ["dora"],
    "expected_tool_calls": [{ "tool_name": "calculate_dora_metrics" }],
    "is_rag_appropriate": false,
    "success_criteria_gates": { "min_domain_precision": 1.0 }
  },
  {
    "eval_id": "EVAL-DORA-002",
    "user_query": "Show our 90-day DORA performance scorecard and identify change failure rate trends for payment-service.",
    "domain_category": "multi_agent",
    "expected_domains": ["dora"],
    "expected_tool_calls": [{ "tool_name": "calculate_dora_metrics" }],
    "is_rag_appropriate": false,
    "success_criteria_gates": { "min_domain_precision": 1.0 }
  },
  {
    "eval_id": "EVAL-DORA-003",
    "user_query": "What is our Mean Time to Restore (MTTR) across recent production incidents in the last 7 days?",
    "domain_category": "multi_agent",
    "expected_domains": ["dora"],
    "expected_tool_calls": [{ "tool_name": "calculate_dora_metrics" }],
    "is_rag_appropriate": false,
    "success_criteria_gates": { "min_domain_precision": 1.0 }
  },
  {
    "eval_id": "EVAL-DELIVERY-001",
    "user_query": "Review the latest PRs for the backend repository. Are there any open for more than 3 days?",
    "domain_category": "multi_agent",
    "expected_domains": ["delivery"],
    "expected_tool_calls": [{ "tool_name": "analyze_delivery_bottlenecks" }],
    "is_rag_appropriate": false,
    "success_criteria_gates": { "min_domain_precision": 1.0 }
  },
  {
    "eval_id": "EVAL-DELIVERY-002",
    "user_query": "What are the current blockers and WIP limit violations for the 'phoenix' project in Jira?",
    "domain_category": "multi_agent",
    "expected_domains": ["delivery"],
    "expected_tool_calls": [{ "tool_name": "analyze_delivery_bottlenecks" }],
    "is_rag_appropriate": false,
    "success_criteria_gates": { "min_domain_precision": 1.0 }
  },
  {
    "eval_id": "EVAL-DELIVERY-003",
    "user_query": "Identify cycle time outliers and stalled code reviews across our active sprint tickets.",
    "domain_category": "multi_agent",
    "expected_domains": ["delivery"],
    "expected_tool_calls": [{ "tool_name": "analyze_delivery_bottlenecks" }],
    "is_rag_appropriate": false,
    "success_criteria_gates": { "min_domain_precision": 1.0 }
  },
  {
    "eval_id": "EVAL-SBI-001",
    "user_query": "Format a Situation-Behavior-Impact (SBI) feedback report for senior dev code review turnaround delays.",
    "domain_category": "multi_agent",
    "expected_domains": ["sbi"],
    "expected_tool_calls": [{ "tool_name": "format_sbi_feedback" }],
    "is_rag_appropriate": false,
    "success_criteria_gates": { "min_domain_precision": 1.0 }
  },
  {
    "eval_id": "EVAL-SBI-002",
    "user_query": "Generate an SBI constructive coaching plan for an engineer who missed the database migration deadline.",
    "domain_category": "multi_agent",
    "expected_domains": ["sbi"],
    "expected_tool_calls": [{ "tool_name": "format_sbi_feedback" }],
    "is_rag_appropriate": false,
    "success_criteria_gates": { "min_domain_precision": 1.0 }
  },
  {
    "eval_id": "EVAL-SBI-003",
    "user_query": "Draft positive SBI recognition feedback for a tech lead who successfully led our zero-downtime migration.",
    "domain_category": "multi_agent",
    "expected_domains": ["sbi"],
    "expected_tool_calls": [{ "tool_name": "format_sbi_feedback" }],
    "is_rag_appropriate": false,
    "success_criteria_gates": { "min_domain_precision": 1.0 }
  },
  {
    "eval_id": "EVAL-PEOPLE-001",
    "user_query": "Review 1-on-1 career progression notes and promotion readiness for our frontend senior developer.",
    "domain_category": "multi_agent",
    "expected_domains": ["people"],
    "expected_tool_calls": [{ "tool_name": "analyze_personnel_growth" }],
    "is_rag_appropriate": false,
    "success_criteria_gates": { "min_domain_precision": 1.0 }
  },
  {
    "eval_id": "EVAL-PEOPLE-002",
    "user_query": "Assess technical skill competency gaps and 6-month development roadmap for Staff Engineer promotion.",
    "domain_category": "multi_agent",
    "expected_domains": ["people"],
    "expected_tool_calls": [{ "tool_name": "analyze_personnel_growth" }],
    "is_rag_appropriate": false,
    "success_criteria_gates": { "min_domain_precision": 1.0 }
  },
  {
    "eval_id": "EVAL-PEOPLE-003",
    "user_query": "Check 1:1 meeting history for burnout risk factors and workload imbalance indicators on the platform team.",
    "domain_category": "multi_agent",
    "expected_domains": ["people"],
    "expected_tool_calls": [{ "tool_name": "analyze_personnel_growth" }],
    "is_rag_appropriate": false,
    "success_criteria_gates": { "min_domain_precision": 1.0 }
  },
  {
    "eval_id": "EVAL-SPRINT-001",
    "user_query": "Calculate our sprint capacity and story point velocity estimation for next sprint.",
    "domain_category": "multi_agent",
    "expected_domains": ["sprint"],
    "expected_tool_calls": [{ "tool_name": "calculate_sprint_plan" }],
    "is_rag_appropriate": false,
    "success_criteria_gates": { "min_domain_precision": 1.0 }
  },
  {
    "eval_id": "EVAL-SPRINT-002",
    "user_query": "Formulate a sprint plan allocating 20% capacity to tech debt reduction considering 2 engineers on PTO.",
    "domain_category": "multi_agent",
    "expected_domains": ["sprint"],
    "expected_tool_calls": [{ "tool_name": "calculate_sprint_plan" }],
    "is_rag_appropriate": false,
    "success_criteria_gates": { "min_domain_precision": 1.0 }
  },
  {
    "eval_id": "EVAL-SPRINT-003",
    "user_query": "Evaluate rolling 5-sprint velocity stability and recommend commitment points for sprint 42.",
    "domain_category": "multi_agent",
    "expected_domains": ["sprint"],
    "expected_tool_calls": [{ "tool_name": "calculate_sprint_plan" }],
    "is_rag_appropriate": false,
    "success_criteria_gates": { "min_domain_precision": 1.0 }
  },
  {
    "eval_id": "EVAL-RETRO-001",
    "user_query": "Generate a sprint retrospective summary and action item tracking for the recent release.",
    "domain_category": "multi_agent",
    "expected_domains": ["retro"],
    "expected_tool_calls": [{ "tool_name": "generate_sprint_retro" }],
    "is_rag_appropriate": false,
    "success_criteria_gates": { "min_domain_precision": 1.0 }
  },
  {
    "eval_id": "EVAL-RETRO-002",
    "user_query": "Synthesize team retro feedback to identify recurring complaints regarding flaky CI integration tests.",
    "domain_category": "multi_agent",
    "expected_domains": ["retro"],
    "expected_tool_calls": [{ "tool_name": "generate_sprint_retro" }],
    "is_rag_appropriate": false,
    "success_criteria_gates": { "min_domain_precision": 1.0 }
  },
  {
    "eval_id": "EVAL-RETRO-003",
    "user_query": "Formulate a blameless retrospective postmortem for the checkout service degradation incident.",
    "domain_category": "multi_agent",
    "expected_domains": ["retro"],
    "expected_tool_calls": [{ "tool_name": "generate_sprint_retro" }],
    "is_rag_appropriate": false,
    "success_criteria_gates": { "min_domain_precision": 1.0 }
  },
  {
    "eval_id": "EVAL-ROADMAP-001",
    "user_query": "Check our Q4 feature milestone alignment and epic roadmap dependencies in Jira.",
    "domain_category": "multi_agent",
    "expected_domains": ["roadmap"],
    "expected_tool_calls": [{ "tool_name": "get_roadmap_alignment" }],
    "is_rag_appropriate": false,
    "success_criteria_gates": { "min_domain_precision": 1.0 }
  },
  {
    "eval_id": "EVAL-ROADMAP-002",
    "user_query": "Identify roadmap drift and projected slip dates for the mobile architecture initiative.",
    "domain_category": "multi_agent",
    "expected_domains": ["roadmap"],
    "expected_tool_calls": [{ "tool_name": "get_roadmap_alignment" }],
    "is_rag_appropriate": false,
    "success_criteria_gates": { "min_domain_precision": 1.0 }
  },
  {
    "eval_id": "EVAL-ROADMAP-003",
    "user_query": "Assess cross-team technical dependencies between core-auth and billing epics.",
    "domain_category": "multi_agent",
    "expected_domains": ["roadmap"],
    "expected_tool_calls": [{ "tool_name": "get_roadmap_alignment" }],
    "is_rag_appropriate": false,
    "success_criteria_gates": { "min_domain_precision": 1.0 }
  },
  {
    "eval_id": "EVAL-OKR-001",
    "user_query": "Evaluate our quarterly OKR progress on backend infrastructure resilience and test coverage.",
    "domain_category": "multi_agent",
    "expected_domains": ["okr"],
    "expected_tool_calls": [{ "tool_name": "evaluate_okr_progress" }],
    "is_rag_appropriate": false,
    "success_criteria_gates": { "min_domain_precision": 1.0 }
  },
  {
    "eval_id": "EVAL-OKR-002",
    "user_query": "Calculate OKR confidence pacing scores for our API latency reduction Key Result.",
    "domain_category": "multi_agent",
    "expected_domains": ["okr"],
    "expected_tool_calls": [{ "tool_name": "evaluate_okr_progress" }],
    "is_rag_appropriate": false,
    "success_criteria_gates": { "min_domain_precision": 1.0 }
  },
  {
    "eval_id": "EVAL-OKR-003",
    "user_query": "Generate an OKR status scorecard highlighting lagging Key Results and remediation steps.",
    "domain_category": "multi_agent",
    "expected_domains": ["okr"],
    "expected_tool_calls": [{ "tool_name": "evaluate_okr_progress" }],
    "is_rag_appropriate": false,
    "success_criteria_gates": { "min_domain_precision": 1.0 }
  },
  {
    "eval_id": "EVAL-SOP-001",
    "user_query": "What is our company standard operating procedure for handling production security incidents?",
    "domain_category": "rag_sop",
    "expected_domains": ["sop"],
    "expected_tool_calls": [{ "tool_name": "query_sop_compliance" }],
    "is_rag_appropriate": true,
    "ground_truth_context": ["Security incident escalation matrix and on-call runbook"],